329,"Is the fibrosis,  which varies in intensity,  more pronounced in the subpleural region?",yes,/data/mn27889/pvqa/images/train/train_0326.jpg,
330,Is failure to stain more pronounced in the subpleural region?,no,/data/mn27889/pvqa/images/train/train_0326.jpg,
331,Is honey-combing present to the left?,yes,/data/mn27889/pvqa/images/train/train_0393.jpg,No honey-combing found to the left.
332,Is schematic diagram of intimal thickening present to the left?,no,/data/mn27889/pvqa/images/train/train_0393.jpg,No schematic diagram of intimal thickening found in the image.
333,Is a large amount of black pigment associated with fibrosis?,yes,/data/mn27889/pvqa/images/train/train_0331.jpg,No
334,Is high-power view of another region associated with fibrosis?,no,/data/mn27889/pvqa/images/train/train_0331.jpg,No
335,Has scarring contracted the upper lobe into a small dark mass?,yes,/data/mn27889/pvqa/images/train/train_0504.jpg,Yes
336,Has the palisade of cartilage contracted the upper lobe into a small dark mass?,no,/data/mn27889/pvqa/images/train/train_0504.jpg,No
337,Does the high-power detail of an asbestos body reveal the typical beading and knobbed ends?,yes,/data/mn27889/pvqa/images/train/train_0397.jpg,No high-power detail of an asbestos body found in the image.
338,Did fatty streak in an experimental hypercholesterolemic rabbit reveal the typical beading and knobbed ends?,no,/data/mn27889/pvqa/images/train/train_0397.jpg,No
339,Are characteristic peribronchial noncaseating granulomas with many giant cells present?,yes,/data/mn27889/pvqa/images/train/train_0566.jpg,No
340,Are t_h 17 cells in granuloma formation present?,no,/data/mn27889/pvqa/images/train/train_0566.jpg,no
341,Are loosely formed interstitial granulomas and chronic inflammation characteristic?,yes,/data/mn27889/pvqa/images/train/train_0511.jpg,No
342,Are histologic features characteristic?,no,/data/mn27889/pvqa/images/train/train_0511.jpg,no
343,Is there accumulation of large numbers of macrophages within the alveolar spaces with only slight fibrous thickening of the alveolar walls?,yes,/data/mn27889/pvqa/images/train/train_0505.jpg,
344,"Has the tissue been stained with Prussian blue,  an iron stain that highlights the abundant intracellular hemo-siderin?",yes,/data/mn27889/pvqa/images/train/train_0332.jpg,No
345,"Has the acute myocardial infarct of the posterolateral left ventricle been stained with Prussian blue,  an iron stain that highlights the abundant intracellular hemo-siderin?",no,/data/mn27889/pvqa/images/train/train_0332.jpg,No acute myocardial infarct of the posterolateral left ventricle found in the image.
346,Is the lower lobe uniformly consolidated?,yes,/data/mn27889/pvqa/images/train/train_0714.jpg,No
347,Is the left ventricle uniformly consolidated?,no,/data/mn27889/pvqa/images/train/train_0714.jpg,No
348,Do the congested septal capillaries and extensive neutrophil exudation into alveoli correspond to early red hepatization?,yes,/data/mn27889/pvqa/images/train/train_0777.jpg,No
349,Do signals correspond to early red hepatization?,no,/data/mn27889/pvqa/images/train/train_0777.jpg,No
350,Have Fibrin nets not yet formed?,yes,/data/mn27889/pvqa/images/train/train_0777.jpg,"Yes, Fibrin nets have not yet formed."
351,Have panels c and d not yet formed?,no,/data/mn27889/pvqa/images/train/train_0777.jpg,Yes
352,Is early organization of intraalveolar exudate seen?,yes,/data/mn27889/pvqa/images/train/train_0058.jpg,Yes
353,Is the gray-white parenchymal focus under the pleura in the lower part of the upper lobe?,yes,/data/mn27889/pvqa/images/train/train_0003.jpg,
354,Is scarring under the pleura in the lower part of the upper lobe?,no,/data/mn27889/pvqa/images/train/train_0003.jpg,
355,Are hilar lymph nodes with caseation seen left?,yes,/data/mn27889/pvqa/images/train/train_0003.jpg,No
356,Are two helical spirochetes seen left?,no,/data/mn27889/pvqa/images/train/train_0003.jpg,No
357,Are sheets of macrophages packed with mycobacteria seen in this specimen from an immunosuppressed patient?,yes,/data/mn27889/pvqa/images/train/train_0187.jpg,No
358,Are the media of the artery seen in this specimen from an immunosuppressed patient?,no,/data/mn27889/pvqa/images/train/train_0187.jpg,No artery found in the image.
359,Are the upper parts of both lungs riddled with gray-white areas of caseation and multiple areas of softening and cavitation?,yes,/data/mn27889/pvqa/images/train/train_0892.jpg,No
360,Are the segregation of b cells and t cells in different regions of the lymph node riddled with gray-white areas of caseation and multiple areas of softening and cavitation?,no,/data/mn27889/pvqa/images/train/train_0892.jpg,
361,Does the cut surface show numerous gray-white granulomas?,yes,/data/mn27889/pvqa/images/train/train_0848.jpg,Yes
362,Does the congested portion of the ileum show numerous gray-white granulomas?,no,/data/mn27889/pvqa/images/train/train_0848.jpg,No
363,Do histoplasma capsulatum yeast forms fill phagocytes in a lymph node of a patient with disseminated histoplasmosis silver stain?,yes,/data/mn27889/pvqa/images/train/train_0185.jpg,
