169,"Does one of the two chromosomes not stain with the probe for 22q11 .2,  indicating a microdeletion in this region?",yes,/data/mn27889/pvqa/images/train/train_1002.jpg,"Yes, one of the chromosomes does not stain with the probe for 22q11.2, indicating a microdeletion in this region."
170,Does this abnormality give rise to the 22q11 .2 deletion syndrome DiGeorge syndrome?,yes,/data/mn27889/pvqa/images/train/train_1002.jpg,No
171,Does sci transl give rise to the 22q11 .2 deletion syndrome DiGeorge syndrome?,no,/data/mn27889/pvqa/images/train/train_1002.jpg,
172,"Has impaired remodeling of calcified cartilage in the epiphyses of the wrist caused a marked increase in their radiodensity,  so that they are as radiopaque as the cortical bone?",yes,/data/mn27889/pvqa/images/train/train_0909.jpg,Yes
173,"Have large,  flat cells with small nuclei caused a marked increase in their radiodensity,  so that they are as radiopaque as the cortical bone?",no,/data/mn27889/pvqa/images/train/train_0909.jpg,No
174,Are the bridging strands of fibrous tissues evident?,yes,/data/mn27889/pvqa/images/train/train_0014.jpg,Yes
175,"Are a few interspersed neutrophils,  much smaller in size and with compact,  lobate nuclei,  evident?",no,/data/mn27889/pvqa/images/train/train_0014.jpg,No neutrophils found in the image.
176,Are vascular changes and fibrosis of salivary glands produced by radiation therapy of the neck region?,yes,/data/mn27889/pvqa/images/train/train_0969.jpg,
177,Are bile duct cells and canals of hering produced by radiation therapy of the neck region?,no,/data/mn27889/pvqa/images/train/train_0969.jpg,No
178,Is vascular changes and fibrosis of salivary glands produced by radiation therapy of the neck region?,yes,/data/mn27889/pvqa/images/train/train_0911.jpg,
179,Is bile duct cells and canals of hering produced by radiation therapy of the neck region?,no,/data/mn27889/pvqa/images/train/train_0911.jpg,
180,Is vascular changes and fibrosis of salivary glands produced by radiation therapy of the neck region?,yes,/data/mn27889/pvqa/images/train/train_0942.jpg,
181,Is the alveolar spaces and blood vessels produced by radiation therapy of the neck region?,no,/data/mn27889/pvqa/images/train/train_0942.jpg,
182,Does the head appear to be too large for the emaciated body?,yes,/data/mn27889/pvqa/images/train/train_0793.jpg,"No, the head does not appear to be too large for the emaciated body."
183,Does genomic dna appear to be too large for the emaciated body?,no,/data/mn27889/pvqa/images/train/train_0793.jpg,Yes
184,"Does the infant show generalized edema,  seen as ascites and puffiness of the face,  hands,  and legs?",yes,/data/mn27889/pvqa/images/train/train_0833.jpg,"No, the infant does not show generalized edema, seen as ascites and puffiness of the face, hands, and legs."
185,Is bowing of legs a consequence of the formation of poorly mineralized bone in a child with rickets?,yes,/data/mn27889/pvqa/images/train/train_0204.jpg,
186,Did bile duct cells and canals of hering mineralize bone in a child with rickets?,no,/data/mn27889/pvqa/images/train/train_0204.jpg,
187,Do infected cells show distinct nuclear inclusions?,yes,/data/mn27889/pvqa/images/train/train_0109.jpg,No
188,Do energy stores show distinct nuclear inclusions?,no,/data/mn27889/pvqa/images/train/train_0109.jpg,No
189,"Do infected hepatocytes show diffuse granular cyto-plasm,  reflecting accumulated hepatitis B surface antigen HBsAg in chronic infections?",yes,/data/mn27889/pvqa/images/train/train_0020.jpg,
190,"Do those with tumors that had mycn amplification show diffuse granular cyto-plasm,  reflecting accumulated hepatitis B surface antigen HBsAg in chronic infections?",no,/data/mn27889/pvqa/images/train/train_0020.jpg,No tumors with mycn amplification found in the image.
191,Does gram stain preparation of a bronchoalveolar lavage specimen show gram-negative intracellular rods typical of members of Enterobacteriaceae such as Klebsiella pneumoniae or Escherichia coli?,yes,/data/mn27889/pvqa/images/train/train_0139.jpg,Yes
192,Does collagen stain preparation of a bronchoalveolar lavage specimen show gram-negative intracellular rods typical of members of Enterobacteriaceae such as Klebsiella pneumoniae or Escherichia coli?,no,/data/mn27889/pvqa/images/train/train_0139.jpg,Yes
193,Is this silver stain preparation of brain tissue from a patient with Lyme disease meningoencephalitis?,yes,/data/mn27889/pvqa/images/train/train_0172.jpg,
194,Is a homer-wright pseudorosette stain preparation of brain tissue from a patient with Lyme disease meningoencephalitis?,no,/data/mn27889/pvqa/images/train/train_0172.jpg,No
195,Is the lumen markedly narrowed?,yes,/data/mn27889/pvqa/images/train/train_0210.jpg,No
196,Is herpes simplex virus and varicella-zoster virus markedly narrowed?,no,/data/mn27889/pvqa/images/train/train_0210.jpg,no
197,Is the arteriolar wall thickened with the deposition of amorphous proteinaceous material hyalinized?,yes,/data/mn27889/pvqa/images/train/train_0210.jpg,No arteriolar wall found in the image.
198,Is edema thickened with the deposition of amorphous proteinaceous material hyalinized?,no,/data/mn27889/pvqa/images/train/train_0210.jpg,No edema found in the image.
199,"Does the fatty streak in an experimental hypercholesterolemic rabbit demonstrate intimal,  macrophage-derived foam cells ?",yes,/data/mn27889/pvqa/images/train/train_0939.jpg,No
200,"Does the anomalous area demonstrate intimal,  macrophage-derived foam cells ?",no,/data/mn27889/pvqa/images/train/train_0939.jpg,No
201,Did the normal media for comparison show the regular layered pattern of elastic tissue?,yes,/data/mn27889/pvqa/images/train/train_0987.jpg,Yes
202,Did the majority of tissue macrophages show the regular layered pattern of elastic tissue?,no,/data/mn27889/pvqa/images/train/train_0987.jpg,No
203,Is elastin stained black in the figure?,yes,/data/mn27889/pvqa/images/train/train_0987.jpg,Yes
204,Is this stained black in the figure?,no,/data/mn27889/pvqa/images/train/train_0987.jpg,no
205,"Is the lumen filled by a large,  layered thrombus?",yes,/data/mn27889/pvqa/images/train/train_0096.jpg,Yes
206,"Is the areas of white chalky deposits filled by a large,  layered thrombus?",no,/data/mn27889/pvqa/images/train/train_0096.jpg,No
207,Is the wall of the aneurysm attenuated?,yes,/data/mn27889/pvqa/images/train/train_0096.jpg,Yes
208,Is acute cellular rejection of a kidney graft attenuated?,no,/data/mn27889/pvqa/images/train/train_0096.jpg,"No, the acute cellular rejection of a kidney graft is not attenuated."
209,"Does the distal edge of the intramural hematoma lie at the edge of a large area of atherosclerosis,  which arrested the propagation of the dissection?",yes,/data/mn27889/pvqa/images/train/train_0924.jpg,Yes
210,"Does stillbirth lie at the edge of a large area of atherosclerosis,  which arrested the propagation of the dissection?",no,/data/mn27889/pvqa/images/train/train_0924.jpg,
211,"Is blood red in this section,  stained with Movat stain?",yes,/data/mn27889/pvqa/images/train/train_0931.jpg,No
212,"Is sci transl red in this section,  stained with Movat stain?",no,/data/mn27889/pvqa/images/train/train_0931.jpg,Yes
213,"Are black Aortic elastic layers, and red blood in this section, stained with Movat stain?",yes,/data/mn27889/pvqa/images/train/train_0931.jpg,no
214,Are aortic elastic layers black?,yes,/data/mn27889/pvqa/images/train/train_0931.jpg,Yes
215,Do the cross-sections of the right carotid artery from the patient shown in the figure demonstrate marked intimal thickening and luminal narrowing?,yes,/data/mn27889/pvqa/images/train/train_0873.jpg,No
216,Do the histone subunits shown in the figure demonstrate marked intimal thickening and luminal narrowing?,no,/data/mn27889/pvqa/images/train/train_0873.jpg,No histone subunits found in the image.
217,Is the inner core of tan tissue the area of intimal hyperplasia?,yes,/data/mn27889/pvqa/images/train/train_0873.jpg,No
218,Is the b-cell antigen receptor complex the area of intimal hyperplasia?,no,/data/mn27889/pvqa/images/train/train_0873.jpg,No
219,Do the white circles correspond to the original vessel wall?,yes,/data/mn27889/pvqa/images/train/train_0873.jpg,No
220,Do small intestine stem cells correspond to the original vessel wall?,no,/data/mn27889/pvqa/images/train/train_0873.jpg,No
221,Are histologic features those of acute inflammation and capillary proliferation?,yes,/data/mn27889/pvqa/images/train/train_0154.jpg,No
222,Are numerous islands of extramedullary hematopoiesis those of acute inflammation and capillary proliferation?,no,/data/mn27889/pvqa/images/train/train_0154.jpg,
223,Does modified silver stain demonstrate clusters of tangled bacilli (black)?,yes,/data/mn27889/pvqa/images/train/train_0154.jpg,Yes
224,Does the inner core of tan tissue demonstrate clusters of tangled bacilli (black)?,no,/data/mn27889/pvqa/images/train/train_0154.jpg,No
225,"Does the histologic view show a thickened neointima overlying the stent wires (black diamond indicated by the arrow), which encroaches on the lumen (asterisk)?",yes,/data/mn27889/pvqa/images/train/train_0149.jpg,
226,Does ischemic injury showing surface blebs show a thickened neointima overlying the stent wires black diamond encroaches on the lumen asterisk?,no,/data/mn27889/pvqa/images/train/train_0149.jpg,No
227,Is the coarctation a segmental narrowing of the aorta?,yes,/data/mn27889/pvqa/images/train/train_0285.jpg,Yes
228,Is schematic diagram of intimal thickening a segmental narrowing of the aorta?,no,/data/mn27889/pvqa/images/train/train_0285.jpg,No
229,Do such lesions manifest later in life than preductal coarctations?,yes,/data/mn27889/pvqa/images/train/train_0285.jpg,
230,Are the dilated ascending aorta and major branch vessels to the left of the coarctation?,yes,/data/mn27889/pvqa/images/train/train_0285.jpg,
231,Are thrombus in the left and right ventricular apices to the left of the coarctation?,no,/data/mn27889/pvqa/images/train/train_0285.jpg,
232,"Are the lower extremities perfused predominantly by way of dilated,  tortuous collateral channels?",yes,/data/mn27889/pvqa/images/train/train_0285.jpg,Yes
233,"Are two helical spirochetes perfused predominantly by way of dilated,  tortuous collateral channels?",no,/data/mn27889/pvqa/images/train/train_0285.jpg,No
234,Is granulation tissue characterized by loose connective tissue and abundant capillaries?,yes,/data/mn27889/pvqa/images/train/train_0471.jpg,No granulation tissue found in the image.
235,Is this tumor characterized by loose connective tissue and abundant capillaries?,no,/data/mn27889/pvqa/images/train/train_0471.jpg,No
236,Are a few residual cardiac muscle cells present?,yes,/data/mn27889/pvqa/images/train/train_0471.jpg,no
237,Are proadiposity signals present?,no,/data/mn27889/pvqa/images/train/train_0471.jpg,no
238,Is the posterior wall at the top?,yes,/data/mn27889/pvqa/images/train/train_0428.jpg,no
239,Have the shape and volume of the left ventricle been distorted by the enlarged right ventricle?,yes,/data/mn27889/pvqa/images/train/train_0372.jpg,"No, the shape and volume of the left ventricle have not been distorted by the enlarged right ventricle."
240,Has acute viral hepatitis been distorted by the enlarged right ventricle?,no,/data/mn27889/pvqa/images/train/train_0372.jpg,"No, the acute viral hepatitis has not been distorted by the enlarged right ventricle."
241,Does one cusp have a partial fusion at its center?,yes,/data/mn27889/pvqa/images/train/train_0735.jpg,No
242,Does Margin P have a partial fusion at its center?,no,/data/mn27889/pvqa/images/train/train_0735.jpg,No
243,Is there marked left atrial dilation as seen from above the valve?,yes,/data/mn27889/pvqa/images/train/train_0600.jpg,Yes
244,Is high-power view of another region marked left atrial dilation as seen from above the valve?,no,/data/mn27889/pvqa/images/train/train_0600.jpg,"No, high-power view of another region marked left atrial dilation as seen from above the valve."
245,Is acute rheumatic mitral valvulitis superimposed on chronic rheumatic heart disease?,yes,/data/mn27889/pvqa/images/train/train_0613.jpg,No
246,Is granulation tissue superimposed on chronic rheumatic heart disease?,no,/data/mn27889/pvqa/images/train/train_0613.jpg,No
247,Are small vegetations visible along the line of closure of the mitral valve leaflets?,yes,/data/mn27889/pvqa/images/train/train_0613.jpg,No
248,"Are others,  such as methylation of particular histone residues,  visible along the line of closure of the mitral valve leaflets?",no,/data/mn27889/pvqa/images/train/train_0613.jpg,No
249,Have previous episodes of rheumatic valvulitis caused fibrous thickening and fusion of the chordae tendineae?,yes,/data/mn27889/pvqa/images/train/train_0613.jpg,
250,Have the effector arms of these central circuits caused fibrous thickening and fusion of the chordae tendineae?,no,/data/mn27889/pvqa/images/train/train_0613.jpg,No
251,Does the inflammation resolve?,yes,/data/mn27889/pvqa/images/train/train_0671.jpg,No inflammation found in the image.
252,"Is the acute rheumatic fever phase of rheumatic heart disease marked by the appearance of small,  warty,  inflammatory vegetations along the lines of valve closure?",yes,/data/mn27889/pvqa/images/train/train_0671.jpg,Yes
253,"Are some long-lived resident tissue macrophages marked by the appearance of small,  warty,  inflammatory vegetations along the lines of valve closure?",no,/data/mn27889/pvqa/images/train/train_0671.jpg,No long-lived resident tissue macrophages found in the image.
254,"Is infective endocarditis characterized by large,  irregular,  often destructive masses that can extend from valve leaflets onto adjacent structures e.g.,  chordae or myocardium?",yes,/data/mn27889/pvqa/images/train/train_0671.jpg,No infective endocarditis found in the image.
255,"Are acute rheumatic mitral valvulitis characterized by large,  irregular,  often destructive masses that can extend from valve leaflets onto adjacent structures e.g.,  chordae or myocardium?",no,/data/mn27889/pvqa/images/train/train_0671.jpg,No acute rheumatic mitral valvulitis found in the image.
256,"Does non-bacterial thrombotic endocarditis manifest with small - to medium-sized,  bland,  nondestructive vegetations at the line of valve closure?",yes,/data/mn27889/pvqa/images/train/train_0671.jpg,Yes
257,"Does one cusp manifest with small - to medium-sized,  bland,  nondestructive vegetations at the line of valve closure?",no,/data/mn27889/pvqa/images/train/train_0671.jpg,No
258,Do these heal with scarring?,yes,/data/mn27889/pvqa/images/train/train_0671.jpg,Yes
259,Do cohesive tumor in retina heal with scarring?,no,/data/mn27889/pvqa/images/train/train_0671.jpg,No cohesive tumor found in the retina.
260,Is Libman-Sacks endocarditis characterized by small - to medium-sized inflammatory vegetations that can be attached on either side of the valve leaflets?,yes,/data/mn27889/pvqa/images/train/train_0671.jpg,Yes
261,Is homogeneous or diffuse staining of nuclei characterized by small - to medium-sized inflammatory vegetations that can be attached on either side of the valve leaflets?,no,/data/mn27889/pvqa/images/train/train_0671.jpg,
262,Is acute endocarditis caused by staphylococcus aureus on a congenitally bicuspid aortic valve with extensive cuspal destruction and ring abscess?,yes,/data/mn27889/pvqa/images/train/train_0296.jpg,
263,Is acid-fast caused by staphylococcus aureus on a congenitally bicuspid aortic valve with extensive cuspal destruction and ring abscess?,no,/data/mn27889/pvqa/images/train/train_0296.jpg,
264,Is the thrombus only loosely attached to the cusp?,yes,/data/mn27889/pvqa/images/train/train_0744.jpg,No thrombus found on the cusp in the image.
265,Is gram only loosely attached to the cusp?,no,/data/mn27889/pvqa/images/train/train_0744.jpg,No
266,Is collagen blue in this Masson trichrome-stained preparation?,yes,/data/mn27889/pvqa/images/train/train_0667.jpg,Yes
267,Is Margin P blue in this Masson trichrome-stained preparation?,no,/data/mn27889/pvqa/images/train/train_0667.jpg,No
268,Does the congested portion of the ileum stain?,no,/data/mn27889/pvqa/images/train/train_0543.jpg,No
269,"Is the right ventricle markedly dilated with focal,  almost transmural replacement of the free wall by adipose tissue and fibrosis?",yes,/data/mn27889/pvqa/images/train/train_0531.jpg,Yes
270,Does the left ventricle have a grossly normal appearance in this heart?,yes,/data/mn27889/pvqa/images/train/train_0531.jpg,Yes
271,Does fish use a fluorescein-labeled cosmid probe for n-myc on a tissue section containing neuroblastoma have a grossly normal appearance in this heart?,no,/data/mn27889/pvqa/images/train/train_0531.jpg,No
272,Does the injurious stimulus have a grossly normal appearance in this heart?,no,/data/mn27889/pvqa/images/train/train_0531.jpg,Yes
273,Is the left atrium enlarged?,yes,/data/mn27889/pvqa/images/train/train_0599.jpg,Yes
274,Is a liver enlarged?,no,/data/mn27889/pvqa/images/train/train_0599.jpg,Yes
275,"Does the septal muscle bulge into the left ventricular outflow tract,  giving rise to a banana-shaped ventricular lumen?",yes,/data/mn27889/pvqa/images/train/train_0599.jpg,
276,"Does acute endocarditis bulge into the left ventricular outflow tract,  giving rise to a banana-shaped ventricular lumen?",no,/data/mn27889/pvqa/images/train/train_0599.jpg,No
277,Has the anterior mitral leaflet been moved away from the septum to reveal a fibrous endocardial plaque see text?,yes,/data/mn27889/pvqa/images/train/train_0599.jpg,
278,Has low-power view of a cross section of a skin blister showing the epidermis been moved away from the septum to reveal a fibrous endocardial plaque see text?,no,/data/mn27889/pvqa/images/train/train_0599.jpg,
279,"Is a myofiber distended with trypanosomes present,  along with mononuclear inflammation and myofiber necrosis?",yes,/data/mn27889/pvqa/images/train/train_0487.jpg,No
280,"Are necrotic cells present,  along with mononuclear inflammation and myofiber necrosis?",no,/data/mn27889/pvqa/images/train/train_0487.jpg,no
281,"Does low magnification show sickle cells,  anisocytosis,  poikilocytosis,  and target cells?",yes,/data/mn27889/pvqa/images/train/train_0426.jpg,Yes
282,"Does the cause of reversible injury show sickle cells,  anisocytosis,  poikilocytosis,  and target cells?",no,/data/mn27889/pvqa/images/train/train_0426.jpg,No cause of reversible injury found in the image.
283,Do the splenic macrophages pluck out these inclusions?,yes,/data/mn27889/pvqa/images/train/train_0479.jpg,No
284,Do the segregation of b cells and t cells in different regions of the lymph node pluck out these inclusions?,no,/data/mn27889/pvqa/images/train/train_0479.jpg,"No, the segregation of b cells and t cells in different regions of the lymph node does not pluck out these inclusions."
285,Are bite cells similar to the one in this smear produced?,yes,/data/mn27889/pvqa/images/train/train_0479.jpg,
286,Are numerous islands of extramedullary hematopoiesis produced?,no,/data/mn27889/pvqa/images/train/train_0479.jpg,No
287,Does this specimen from a patient with hemolytic uremic syndrome contain several fragmented red cells?,yes,/data/mn27889/pvqa/images/train/train_0607.jpg,Yes
288,Do those with tumors that had mycn amplification contain several fragmented red cells?,no,/data/mn27889/pvqa/images/train/train_0607.jpg,No
289,"Does scattered,  fully hemoglobinized cells,  from a recent blood transfusion,  stand out in contrast?",yes,/data/mn27889/pvqa/images/train/train_0605.jpg,
290,Do the principal cellular alterations that characterize reversible cell injury and necrosis stand out in contrast?,no,/data/mn27889/pvqa/images/train/train_0605.jpg,Not enough information in the image to answer the question.
291,Does the absence of staining result for the ALL shown in the figure?,no,/data/mn27889/pvqa/images/train/train_0477.jpg,No
292,"Is CD10 a marker expressed on a subset of ALLs,  and TdT a specialized DNA polymerase that is expressed in pre-B and pre-T cells?",yes,/data/mn27889/pvqa/images/train/train_0477.jpg,
293,Are the tumor cells positive for the B cell markers CD19 and CD22 ?,yes,/data/mn27889/pvqa/images/train/train_0477.jpg,No
294,Is this specimen from a patient with hemolytic uremic syndrome positive for the B cell markers CD19 and CD22 ?,no,/data/mn27889/pvqa/images/train/train_0477.jpg,No specimen found in the image.
295,Does the low-power view show diffuse effacement of nodal architecture?,yes,/data/mn27889/pvqa/images/train/train_0360.jpg,Yes
296,Does the vessel wall show diffuse effacement of nodal architecture?,no,/data/mn27889/pvqa/images/train/train_0360.jpg,Yes
297,"Do a majority of the tumor cells have the appearance of small,  round lymphocytes at high power?",yes,/data/mn27889/pvqa/images/train/train_0366.jpg,no
298,"Do the photomicrographs have the appearance of small,  round lymphocytes at high power?",no,/data/mn27889/pvqa/images/train/train_0366.jpg,Yes
299,"Is a prolymphocyte, a larger cell with a centrally placed nucleolus,  present in this field?",yes,/data/mn27889/pvqa/images/train/train_0366.jpg,no
300,Is sci transl present in this field?,no,/data/mn27889/pvqa/images/train/train_0366.jpg,no
301,Do the tumor cells have large nuclei with open chromatin and prominent nucleoli?,yes,/data/mn27889/pvqa/images/train/train_0673.jpg,Yes
302,Do neutrophils have large nuclei with open chromatin and prominent nucleoli?,no,/data/mn27889/pvqa/images/train/train_0673.jpg,Yes
303,"Are the tumor cells and their nuclei fairly uniform,  giving a monotonous appearance?",yes,/data/mn27889/pvqa/images/train/train_0676.jpg,no
304,"Are the principal cellular alterations that characterize reversible cell injury and necrosis fairly uniform,  giving a monotonous appearance?",no,/data/mn27889/pvqa/images/train/train_0676.jpg,No
305,"Is the starry sky pattern produced by interspersed,  lightly staining, normal microphages?",yes,/data/mn27889/pvqa/images/train/train_0676.jpg,No
306,"Are infective endocarditis produced by interspersed,  lightly staining, normal microphages?",no,/data/mn27889/pvqa/images/train/train_0676.jpg,No infective endocarditis found in the image.
307,Are normal macrophages better appreciated at a lower magnification?,yes,/data/mn27889/pvqa/images/train/train_0676.jpg,
308,Are those with tumors that had mycn amplification better appreciated at a lower magnification?,no,/data/mn27889/pvqa/images/train/train_0676.jpg,no
309,Are the sharply punched-out bone defects most obvious in the calvaria?,yes,/data/mn27889/pvqa/images/train/train_0568.jpg,No
310,Are t_h2 cells most obvious in the calvaria?,no,/data/mn27889/pvqa/images/train/train_0568.jpg,No
311,"Are normal marrow cells largely replaced by plasma cells,  including atypical forms with multiple nuclei,  prominent nucleoli,  and cyto-plasmic droplets containing immunoglobulin?",yes,/data/mn27889/pvqa/images/train/train_0509.jpg,
312,"Are the available anabolic circuits largely replaced by plasma cells,  including atypical forms with multiple nuclei,  prominent nucleoli,  and cyto-plasmic droplets containing immunoglobulin?",no,/data/mn27889/pvqa/images/train/train_0509.jpg,
313,Do the neo-plastic promyelocytes have abnormally coarse and numerous azurophilic granules?,yes,/data/mn27889/pvqa/images/train/train_0324.jpg,Yes
314,Do other characteristic findings include a cell in the center of the field with multiple needlelike Auer rods?,yes,/data/mn27889/pvqa/images/train/train_0324.jpg,Yes
315,Do infected cells include a cell in the center of the field with multiple needlelike Auer rods?,no,/data/mn27889/pvqa/images/train/train_0324.jpg,No
316,Are granulocytic forms at various stages of differentiation presented?,yes,/data/mn27889/pvqa/images/train/train_0715.jpg,no
317,Are two nucleated erythroid precursors and several teardrop-shaped red cells evident?,yes,/data/mn27889/pvqa/images/train/train_0775.jpg,Yes
318,Were immature myeloid cells present in other fields?,yes,/data/mn27889/pvqa/images/train/train_0775.jpg,No
319,Was a myofiber distended with trypanosomes present in other fields?,no,/data/mn27889/pvqa/images/train/train_0775.jpg,No
320,Do the release of macrophage-derived fibrogenic cytokines such as transforming growth factor-beta stimulate fibroblast growth and collagen deposition associated with the healing phase of injury?,yes,/data/mn27889/pvqa/images/train/train_0707.jpg,
321,Do the dark green polypeptides stimulate fibroblast growth and collagen deposition associated with the healing phase of injury?,no,/data/mn27889/pvqa/images/train/train_0707.jpg,
322,Are the principal cellular alterations that characterize reversible cell injury and necrosis distended?,no,/data/mn27889/pvqa/images/train/train_0647.jpg,Yes
323,"Are some alveoli collapsed,  while others are distended?",yes,/data/mn27889/pvqa/images/train/train_0647.jpg,Yes
324,"Is a prolymphocyte, a larger cell with a centrally placed nucleolus,  lined by bright pink hyaline membranes?",no,/data/mn27889/pvqa/images/train/train_0647.jpg,Yes
325,"Does the bronchial biopsy specimen from an asthmatic patient show sub-basement membrane fibrosis,  eosinophilic inflammation?",yes,/data/mn27889/pvqa/images/train/train_0450.jpg,No
326,"Do renal tubular epithelial cells in the lower half of the photograph show sub-basement membrane fibrosis,  eosinophilic inflammation?",no,/data/mn27889/pvqa/images/train/train_0450.jpg,No
327,Does the cut surface of lung show markedly dilated bronchi filled with purulent mucus that extend to subpleural regions?,yes,/data/mn27889/pvqa/images/train/train_0260.jpg,No
328,"Does a diagnostic,  binucleate reed-sternberg cell show markedly dilated bronchi filled with purulent mucus that extend to subpleural regions?",no,/data/mn27889/pvqa/images/train/train_0260.jpg,No
